{
  "schema": "omx-bench/1",
  "id": "rpi5-20261101-1",
  "machine": {
    "class": "rpi5",
    "model": "Raspberry Pi 5 Model B Rev 1.0",
    "cpu": "Cortex-A76",
    "cores": 4,
    "ram_mb": 4049,
    "os": "Debian 13",
    "kernel": "6.18.50+rpt-rpi-2712",
    "governor": "performance"
  },
  "software": {
    "plugin-hostd": "0.15.8~meas20261101",
    "omx-clap-host": "0.26.1",
    "mod-host": "0.10.6-595-g6c1cdd8 (not packaged)",
    "jalv": "1.6.9 (not packaged)",
    "jack": "1.9.22~dfsg-4",
    "omx-plugins-clap": "0.16.0",
    "omx-plugins-lv2": "0.16.0",
    "calf-plugins": "5:0.90.3-1kxstudio3"
  },
  "scenarios": [
    {
      "id": "cvp24",
      "title": "chains vs processes, 24 plugins",
      "host": "H2",
      "rate": 48000,
      "frames": 256,
      "plugins": [
        "omx-comp (CLAP)",
        "Calf Compressor (LV2)",
        "omx-delay (CLAP)",
        "omx-drive (CLAP)",
        "omx-comp (CLAP)",
        "Calf Compressor (LV2)",
        "omx-delay (CLAP)",
        "omx-drive (CLAP)",
        "omx-comp (CLAP)",
        "Calf Compressor (LV2)",
        "omx-delay (CLAP)",
        "omx-drive (CLAP)",
        "omx-comp (CLAP)",
        "Calf Compressor (LV2)",
        "omx-delay (CLAP)",
        "omx-drive (CLAP)",
        "omx-comp (CLAP)",
        "Calf Compressor (LV2)",
        "omx-delay (CLAP)",
        "omx-drive (CLAP)",
        "omx-comp (CLAP)",
        "Calf Compressor (LV2)",
        "omx-delay (CLAP)",
        "omx-drive (CLAP)"
      ],
      "dsp_load_avg": 17.34,
      "dsp_load_max": 17.45,
      "samples": 10,
      "rss_mb": 2684.2,
      "add_ms": 1933.4,
      "recover_ms": null,
      "status": "ok",
      "note": "",
      "stress": "none",
      "mode": "individual",
      "xruns": 0,
      "processes": 25,
      "rss_mb_total": 2684.2,
      "pss_mb_total": 183.7,
      "cpu_pct": 24.0,
      "ctx_switches": 67152,
      "ctx_involuntary": 1744,
      "latency_frames": 432,
      "jack_clients": 24,
      "repeats": 3,
      "spread": {
        "dsp_load_avg": [
          17.22,
          17.59
        ],
        "dsp_load_max": [
          17.29,
          19.41
        ],
        "rss_mb": [
          2684.1,
          2684.3
        ],
        "add_ms": [
          1901.4,
          1955.0
        ],
        "processes": [
          25,
          25
        ],
        "rss_mb_total": [
          2684.1,
          2684.3
        ],
        "pss_mb_total": [
          183.7,
          183.8
        ],
        "cpu_pct": [
          23.91,
          24.44
        ],
        "ctx_switches": [
          67101,
          67205
        ],
        "ctx_involuntary": [
          1679,
          1778
        ],
        "xruns": [
          0,
          0
        ],
        "latency_frames": [
          432,
          432
        ],
        "jack_clients": [
          24,
          24
        ]
      }
    },
    {
      "id": "cvp24",
      "title": "chains vs processes, 24 plugins",
      "host": "H2",
      "rate": 48000,
      "frames": 256,
      "plugins": [
        "omx-comp (CLAP)",
        "Calf Compressor (LV2)",
        "omx-delay (CLAP)",
        "omx-drive (CLAP)",
        "omx-comp (CLAP)",
        "Calf Compressor (LV2)",
        "omx-delay (CLAP)",
        "omx-drive (CLAP)",
        "omx-comp (CLAP)",
        "Calf Compressor (LV2)",
        "omx-delay (CLAP)",
        "omx-drive (CLAP)",
        "omx-comp (CLAP)",
        "Calf Compressor (LV2)",
        "omx-delay (CLAP)",
        "omx-drive (CLAP)",
        "omx-comp (CLAP)",
        "Calf Compressor (LV2)",
        "omx-delay (CLAP)",
        "omx-drive (CLAP)",
        "omx-comp (CLAP)",
        "Calf Compressor (LV2)",
        "omx-delay (CLAP)",
        "omx-drive (CLAP)"
      ],
      "dsp_load_avg": 12.32,
      "dsp_load_max": 12.69,
      "samples": 10,
      "rss_mb": 148.0,
      "add_ms": 4586.1,
      "recover_ms": null,
      "status": "ok",
      "note": "",
      "stress": "none",
      "mode": "chain",
      "xruns": 0,
      "processes": 2,
      "rss_mb_total": 148.0,
      "pss_mb_total": 66.3,
      "cpu_pct": 12.64,
      "ctx_switches": 3200,
      "ctx_involuntary": 51,
      "latency_frames": 432,
      "jack_clients": 1,
      "repeats": 3,
      "spread": {
        "dsp_load_avg": [
          12.32,
          12.5
        ],
        "dsp_load_max": [
          12.38,
          12.76
        ],
        "rss_mb": [
          148.0,
          148.5
        ],
        "add_ms": [
          4564.8,
          4602.0
        ],
        "processes": [
          2,
          2
        ],
        "rss_mb_total": [
          148.0,
          148.5
        ],
        "pss_mb_total": [
          66.3,
          66.3
        ],
        "cpu_pct": [
          12.55,
          12.64
        ],
        "ctx_switches": [
          3196,
          3203
        ],
        "ctx_involuntary": [
          45,
          55
        ],
        "xruns": [
          0,
          0
        ],
        "latency_frames": [
          432,
          432
        ],
        "jack_clients": [
          1,
          1
        ]
      }
    },
    {
      "id": "cvp24",
      "title": "chains vs processes, 24 plugins",
      "host": "H2",
      "rate": 48000,
      "frames": 256,
      "plugins": [
        "omx-comp (CLAP)",
        "Calf Compressor (LV2)",
        "omx-delay (CLAP)",
        "omx-drive (CLAP)",
        "omx-comp (CLAP)",
        "Calf Compressor (LV2)",
        "omx-delay (CLAP)",
        "omx-drive (CLAP)",
        "omx-comp (CLAP)",
        "Calf Compressor (LV2)",
        "omx-delay (CLAP)",
        "omx-drive (CLAP)",
        "omx-comp (CLAP)",
        "Calf Compressor (LV2)",
        "omx-delay (CLAP)",
        "omx-drive (CLAP)",
        "omx-comp (CLAP)",
        "Calf Compressor (LV2)",
        "omx-delay (CLAP)",
        "omx-drive (CLAP)",
        "omx-comp (CLAP)",
        "Calf Compressor (LV2)",
        "omx-delay (CLAP)",
        "omx-drive (CLAP)"
      ],
      "dsp_load_avg": 12.37,
      "dsp_load_max": 12.6,
      "samples": 10,
      "rss_mb": 146.7,
      "add_ms": 422.1,
      "recover_ms": null,
      "status": "ok",
      "note": "",
      "stress": "none",
      "mode": "chain-add",
      "xruns": 0,
      "processes": 2,
      "rss_mb_total": 146.7,
      "pss_mb_total": 64.8,
      "cpu_pct": 12.64,
      "ctx_switches": 3183,
      "ctx_involuntary": 34,
      "latency_frames": 432,
      "jack_clients": 1,
      "repeats": 3,
      "spread": {
        "dsp_load_avg": [
          12.31,
          12.45
        ],
        "dsp_load_max": [
          12.34,
          12.62
        ],
        "rss_mb": [
          146.3,
          146.8
        ],
        "add_ms": [
          419.2,
          422.3
        ],
        "processes": [
          2,
          2
        ],
        "rss_mb_total": [
          146.3,
          146.8
        ],
        "pss_mb_total": [
          64.7,
          64.8
        ],
        "cpu_pct": [
          12.55,
          12.73
        ],
        "ctx_switches": [
          3175,
          3184
        ],
        "ctx_involuntary": [
          25,
          35
        ],
        "xruns": [
          0,
          0
        ],
        "latency_frames": [
          432,
          432
        ],
        "jack_clients": [
          1,
          1
        ]
      }
    },
    {
      "id": "cvp24",
      "title": "chains vs processes, 24 plugins",
      "host": "H1",
      "rate": 48000,
      "frames": 256,
      "plugins": [
        "omx-comp (CLAP)",
        "Calf Compressor (LV2)",
        "omx-delay (CLAP)",
        "omx-drive (CLAP)",
        "omx-comp (CLAP)",
        "Calf Compressor (LV2)",
        "omx-delay (CLAP)",
        "omx-drive (CLAP)",
        "omx-comp (CLAP)",
        "Calf Compressor (LV2)",
        "omx-delay (CLAP)",
        "omx-drive (CLAP)",
        "omx-comp (CLAP)",
        "Calf Compressor (LV2)",
        "omx-delay (CLAP)",
        "omx-drive (CLAP)",
        "omx-comp (CLAP)",
        "Calf Compressor (LV2)",
        "omx-delay (CLAP)",
        "omx-drive (CLAP)",
        "omx-comp (CLAP)",
        "Calf Compressor (LV2)",
        "omx-delay (CLAP)",
        "omx-drive (CLAP)"
      ],
      "dsp_load_avg": 15.12,
      "dsp_load_max": 15.31,
      "samples": 10,
      "rss_mb": 145.0,
      "add_ms": 885.7,
      "recover_ms": null,
      "status": "ok",
      "note": "",
      "stress": "none",
      "mode": "shared-process",
      "xruns": 0,
      "processes": 1,
      "rss_mb_total": 145.0,
      "pss_mb_total": 65.4,
      "cpu_pct": 15.64,
      "ctx_switches": 52016,
      "ctx_involuntary": 87,
      "latency_frames": 432,
      "jack_clients": 24,
      "repeats": 3,
      "spread": {
        "dsp_load_avg": [
          14.93,
          15.15
        ],
        "dsp_load_max": [
          15.15,
          15.35
        ],
        "rss_mb": [
          144.7,
          145.0
        ],
        "add_ms": [
          826.7,
          891.1
        ],
        "processes": [
          1,
          1
        ],
        "rss_mb_total": [
          144.7,
          145.0
        ],
        "pss_mb_total": [
          65.4,
          65.5
        ],
        "cpu_pct": [
          15.46,
          15.73
        ],
        "ctx_switches": [
          52012,
          52046
        ],
        "ctx_involuntary": [
          84,
          107
        ],
        "xruns": [
          0,
          0
        ],
        "latency_frames": [
          432,
          432
        ],
        "jack_clients": [
          24,
          24
        ]
      }
    },
    {
      "id": "cvp24",
      "title": "chains vs processes, 24 plugins",
      "host": "H3",
      "rate": 48000,
      "frames": 256,
      "plugins": [
        "omx-comp (LV2)",
        "Calf Compressor (LV2)",
        "omx-delay (LV2)",
        "omx-drive (LV2)",
        "omx-comp (LV2)",
        "Calf Compressor (LV2)",
        "omx-delay (LV2)",